"用户查询","ChatSOS","GPT35-Turbo"
"（通识性问答）","根据给定的信息，我们可以得知以下情况可能导致燃气","燃气泄漏可能由多种原因引起，包括设备"
"为什么会发生","泄漏：","故障、人为错误、管道损坏、不当使用或安"
"燃气泄漏，有什","1燃气管道老化腐蚀：老旧燃气管道设施腐蚀造成的事","装等。以下是一些常见的燃气泄漏原因和"
"么预防办法吗?","故比例增加，这类事故隐蔽性强、不易及时发现，易酿","预防措施:"
"","成严重后果。","燃气泄漏原因:"
"","2管道破损：管道的老化破损、脱落或动物咬噬等情况","1设备故障或老化:燃气设备、管道或阀门"
"","可能导致燃气泄漏。","因长时间使用或制造缺陷可能出现故障，"
"","3第三方施工破坏：燃气管网中，第三方施工破坏事故","导致泄漏。"
"","数量占比较高，可能施工不慎损坏了燃气管道。","2人为错误:错误的操作、不当维修、不规范"
"","4车辆撞击：地上燃气管道防护措施不到位，车辆撞击","的安装和施工可能导致管道破裂或连接处"
"","导致燃气管道泄漏。","松动，引发泄漏。"
"","针对燃气泄漏的预防措施包括：","3管道损坏:管道遭受外部压力、物理损坏、"
"","1管道维护与更新：加强老旧燃气管道的更新改造，及","地震或自然灾害可能导致管道破裂。"
"","时检修和更换老化腐蚀的管道，减少泄漏风险。","4不当使用:例如，在不通风的空间使用燃"
"","2定期检查：定期对燃气管道进行检查和维护，确保管","气器具可能导致积聚的燃气泄漏。"
"","道的完整性和安全性。","燃气泄漏的预防和安全措施:"
"","3连接软管和燃气灶具的检查：用户端连接软管问题仍","1定期检查和维护:定期检查家庭用具、管"
"","然是引发户内事故的主要原因，应定期检查连接软管和","道和燃气设备，确保其状态良好，没有泄"
"","燃气灶具的安全性，及时更换老化损坏的软管和灶具。","漏。"
"","4燃气阀门的正确使用：用户在使用燃气时，应正确关","2合格安装:由专业人员合格安装和维护燃"
"","闭燃气阀门，避免瓶阀未关闭引发事故。","气设备，确保安装符合相关安全标准。"
"","5燃气灶具的正确使用：用户在使用燃气灶具时，应避","3使用燃气报警器:在可能泄漏的区域安装"
"","免无人看管和干烧，加强对用户安全使用燃气知识的宣","燃气报警器，能够及时检测到燃气泄漏并"
"","传教育，推广使用具有防干烧功能的灶具。","发出警报。"
"","6加强安全宣传教育：对用户和相关从业人员进行燃气","4通风:确保室内通风良好，特别是在使用"
"","安全宣传教育，提高他们的安全意识和使用燃气的技能。","燃气设备的封闭空间内。"
"","综上所述，通过管道维护与更新、定期检查、正确使用","5安全使用:使用燃气器具时遵循使用说"
"","燃气阀门和灶具、加强安全宣传教育等措施，可以预防","明，避免长时间不间断使用，确保炉具在使"
"","燃气泄漏事故的发生。","用后关闭。"
"","","6防止损坏:避免在地下或易受损害的地方"
"","","铺设燃气管道，以减少外部压力引起的破"
"","","裂风险。"
"","","7应急处理:如果怀疑有燃气泄漏，立即打"
"","","开门窗通风，离开泄漏现场，不要使用手机"
"","","或电器设备，以免引发火源，然后拨打紧"
"","","急救援电话。"
"","","请注意，如果你怀疑家中有燃气泄漏，绝对"
"","","不能使用明火、电器开关，或者手机等可能"
"","","引发火源的设备，应立即采取安全措施并"
"","","呼叫紧急救援电话。"
